{
  "analysis_id": "analysis.improved",
  "authority_evidence": {
    "authority_bundle_id": "authority.fixture",
    "capabilities": [
      {
        "activation": {
          "activation_type": "phase_entry",
          "currently_authorized": true,
          "prerequisites": [
            "plan accepted"
          ],
          "required_phase": "implementation",
          "source_authority_id": "authority.user"
        },
        "available": true,
        "capability_id": "capability.codex-write",
        "description": "Codex may implement files in the target.",
        "owner": "codex"
      }
    ],
    "content_hash": "sha256:a8355b6929ba8e59a37140bcd7abd8021e23b8bc6b722172845279ef23c8913f",
    "repository_root": "C:\\fixture-repository",
    "schema_version": "1.0.0",
    "sources": [
      {
        "authority_id": "authority.user",
        "authority_type": "user_instruction",
        "content_hash": "sha256:d3ce1562690ddf2dbe82809f308c0402b8176bb6646facd4a6c2e9f4c1fb4b37",
        "evidence_status": "verified",
        "path": "fixture:user",
        "precedence": 0,
        "scope": "src/**"
      }
    ]
  },
  "baseline": {
    "authority_hashes": [
      {
        "authority_id": "authority.user",
        "content_hash": "sha256:d3ce1562690ddf2dbe82809f308c0402b8176bb6646facd4a6c2e9f4c1fb4b37"
      }
    ],
    "baseline_id": "baseline.fixture",
    "captured_at": "2026-01-01T00:00:00Z",
    "content_hash": "sha256:1c32e01163427bd8c665f642c45b3988674ce8e430d30f08560eab4754a09278",
    "dirty_state": "untracked",
    "entries": [
      {
        "classification": "relevant",
        "content_hash": "sha256:4f1cf8d86a66caf554db9ac662dfe98a531cc614c2c4309a5e04c5f74912d3fd",
        "path": "src/output.txt"
      }
    ],
    "git_head": null,
    "git_state": "unborn",
    "repository_kind": "filesystem",
    "repository_root": "C:\\fixture-repository",
    "schema_version": "1.0.0",
    "scope": {
      "mode": "scoped",
      "protected_paths": [
        "AGENTS.md"
      ],
      "relevant_paths": [
        "src"
      ]
    }
  },
  "evidence": [
    {
      "claim": "Only same-process behavior is visible.",
      "collected_at": "2026-01-01T00:00:00Z",
      "collected_by": "deterministic_local",
      "content_hash": "sha256:1352df765aa1ea345845595b1bc14e8034bd58d3decb69580b3beaec88060507",
      "evidence_id": "evidence.analysis",
      "evidence_type": "authority_document",
      "locator": {
        "kind": "artifact_id",
        "value": "evidence.analysis"
      },
      "payload_summary": "",
      "schema_version": "1.0.0",
      "source": {
        "evidence_status": "verified",
        "location": "fixture",
        "source_id": "source.evidence.analysis",
        "source_type": "user_intent"
      },
      "visibility": "analysis_input"
    },
    {
      "claim": "Production-host restart evidence is now supplied.",
      "collected_at": "2026-01-01T00:00:00Z",
      "collected_by": "deterministic_local",
      "content_hash": "sha256:3ad40fa750a5218babb0872ff5ef4c9d4fb54201ecaae4b1372499f7e2612eb7",
      "evidence_id": "evidence.closure",
      "evidence_type": "artifact",
      "locator": {
        "kind": "artifact_id",
        "value": "evidence.closure"
      },
      "payload_summary": "",
      "schema_version": "1.0.0",
      "source": {
        "evidence_status": "verified",
        "location": "fixture",
        "source_id": "source.evidence.closure",
        "source_type": "user_intent"
      },
      "visibility": "closure_input"
    }
  ],
  "plan": {
    "actions": [
      {
        "action_id": "action.write-output",
        "activation": {
          "activation_source": "authority.user",
          "activation_type": "phase_entry",
          "currently_authorized": true
        },
        "capability_id": "capability.codex-write",
        "depends_on": [],
        "expected_outputs": [
          {
            "artifact_path": "src/output.txt",
            "description": "Durable production output.",
            "output_id": "output.durable"
          }
        ],
        "objective": "Create durable output.",
        "owner": "codex",
        "phase": "implementation",
        "prerequisites": [
          {
            "condition": "Plan is accepted.",
            "prerequisite_id": "prerequisite.accepted",
            "status": "satisfied"
          }
        ],
        "requirement_ids": [
          "requirement.durable-output"
        ],
        "target_paths": [
          "src/output.txt"
        ]
      }
    ],
    "assumptions": [],
    "authority_bundle_reference": {
      "artifact_id": "authority.fixture",
      "content_hash": "sha256:a8355b6929ba8e59a37140bcd7abd8021e23b8bc6b722172845279ef23c8913f",
      "schema_id": "https://theoneshot.dev/schemas/aflow/v1/authority-evidence.schema.json",
      "version": "1.0.0"
    },
    "authority_risks": [
      {
        "description": "No unresolved authority risk.",
        "risk_id": "risk.none",
        "status": "none_identified"
      }
    ],
    "created_by": "codex",
    "dependencies": [
      {
        "dependency_id": "dependency.none",
        "description": "No external dependency is required.",
        "source": {
          "evidence_status": "verified",
          "location": "fixture",
          "source_id": "source.user",
          "source_type": "user_intent"
        },
        "status": "not_required"
      }
    ],
    "excluded_paths": [
      {
        "authority_status": "prohibited",
        "path": "private",
        "reason": "Outside scope"
      }
    ],
    "failure_handling": [
      {
        "action": "return_to_codex",
        "condition": "Required proof is absent.",
        "failure_id": "failure.proof",
        "recovery_condition": "Matching proof is supplied."
      }
    ],
    "interpretation": "Implement only the bounded target and prove the production-host observable outcome.",
    "objective": "Produce and prove the locked durable output.",
    "plan_id": "plan.fixture",
    "repository_baseline_reference": {
      "artifact_id": "baseline.fixture",
      "content_hash": "sha256:1c32e01163427bd8c665f642c45b3988674ce8e430d30f08560eab4754a09278",
      "schema_id": "https://theoneshot.dev/schemas/aflow/v1/baseline.schema.json",
      "version": "1.0.0"
    },
    "requirements_coverage": [
      {
        "action_ids": [
          "action.write-output"
        ],
        "requirement_id": "requirement.durable-output",
        "validation_ids": [
          "validation.production"
        ]
      }
    ],
    "schema_version": "1.0.0",
    "stop_conditions": [
      {
        "condition": "Authority changes.",
        "effect": "stop_execution",
        "resume_condition": "Reanalysis succeeds.",
        "stop_id": "stop.authority"
      }
    ],
    "success_definition_reference": {
      "artifact_id": "success.fixture",
      "content_hash": "sha256:dffb7f233ddb37249741052a1f074078e31f8ad5750f8caeef4751afe5327487",
      "schema_id": "https://theoneshot.dev/schemas/aflow/v1/success-definition.schema.json",
      "version": "1.0.0"
    },
    "target_paths": [
      {
        "authority_status": "allowed",
        "path": "src/output.txt",
        "reason": "Approved output"
      }
    ],
    "validations": [
      {
        "action_ids": [
          "action.write-output"
        ],
        "evidence_expected": [
          "artifact",
          "test_result"
        ],
        "executor": "codex",
        "fail_condition": "Output is absent or only substitute behavior was tested.",
        "pass_condition": "Output remains visible and correct after restart.",
        "procedure": "Inspect artifact and restart behavior at the production host boundary.",
        "proof_id": "proof.production-observation",
        "proof_type": "artifact",
        "required_environment": "production-host",
        "requirement_ids": [
          "requirement.durable-output"
        ],
        "validation_id": "validation.production"
      }
    ],
    "version": "1.0.1"
  },
  "repository_evidence": {
    "captured_at": "2026-01-01T00:00:00Z",
    "content_hash": "sha256:cca10f7412ea7225d7323f7bbc28e441dcfce6b90edc6e829d88da4b857a81ff",
    "entries": [
      {
        "active_status": "active",
        "content_hash": "sha256:4f1cf8d86a66caf554db9ac662dfe98a531cc614c2c4309a5e04c5f74912d3fd",
        "entry_type": "file",
        "evidence_status": "verified",
        "path": "src/output.txt",
        "summary": "Simulated fixture output path."
      }
    ],
    "repository_evidence_id": "repository.fixture",
    "repository_kind": "filesystem",
    "repository_root": "C:\\fixture-repository",
    "schema_version": "1.0.0",
    "state": {
      "dirty_state": "untracked",
      "git_head": null,
      "git_state": "unborn"
    }
  },
  "schema_version": "1.0.0",
  "success_definition": {
    "actors": [
      {
        "actor_id": "actor.codex",
        "expected_capability": "Implement the approved plan.",
        "role": "builder"
      }
    ],
    "confirmation": {
      "confirmed_at": "2026-01-01T00:00:00Z",
      "confirmed_by": "user",
      "content_hash": "sha256:dffb7f233ddb37249741052a1f074078e31f8ad5750f8caeef4751afe5327487"
    },
    "non_goals": [
      {
        "non_goal_id": "nongoal.container",
        "statement": "Container execution is outside A-Flow."
      }
    ],
    "prohibited_outcomes": [
      {
        "blocking": true,
        "outcome_id": "outcome.data-loss",
        "statement": "Existing user data is deleted."
      }
    ],
    "proof_obligations": [
      {
        "executor": "codex",
        "fail_condition": "The artifact is absent, substituted, contradicted, or quality evidence is incomplete.",
        "pass_condition": "Artifact and restart evidence prove every declared quality dimension.",
        "procedure": "Observe the produced artifact and restart behavior at the production host boundary.",